<?xml version="1.0"?>
<!DOCTYPE Report
[
<!ELEMENT Report (General ,(Doc|BPT)) >
<!ATTLIST Report ver CDATA #REQUIRED tmZone CDATA #REQUIRED>

<!ELEMENT General ( DocLocation ) >
<!ATTLIST General productName CDATA #REQUIRED productVer CDATA #REQUIRED os CDATA #REQUIRED host CDATA #REQUIRED qcserver CDATA #IMPLIED qcproject CDATA #IMPLIED SolManSolutionId CDATA #IMPLIED SolManProjectId CDATA #IMPLIED SolManTestPlanId CDATA #IMPLIED SolManTestPackageId CDATA #IMPLIED SolManUserInfoData CDATA #IMPLIED  >

<!ELEMENT BPT (DName,Res,DVer?,TSet?,TInst?,NodeArgs,AdditionalInfo*,Doc*) >
<!ATTLIST BPT rID ID #REQUIRED >

<!ELEMENT Doc (DName,ConfName?,Res,DVer?,TSet?,TInst?,RunType?,DT?,AdditionalInfo*,Step*,DIter*,Step*,Action*,Doc*,Summary?,TestMaintenanceSummary*,NodeArgs?) >
<!ATTLIST Doc rID ID #REQUIRED type (Test|BC|BPTWrapperTest|Flow|Group|Action) "Test" productName CDATA #REQUIRED BCIter CDATA #IMPLIED >

<!ELEMENT RunType ( #PCDATA )>
<!ATTLIST RunType fmStep (False|True) "False" batch (False|True) "False" upDesc (False|True) "False" upChk (False|True) "False" upAS (False|True) "False">

<!ELEMENT DName ( #PCDATA ) >

<!ELEMENT ConfName ( #PCDATA ) >

<!ELEMENT Res ( #PCDATA ) >

<!ELEMENT AdditionalInfo (AdditionalDataName,AdditionalDataValue ) >

<!ELEMENT AdditionalDataName ( #PCDATA ) >

<!ELEMENT AdditionalDataValue ( #PCDATA ) >

<!ELEMENT DVer ( #PCDATA ) >

<!ELEMENT TSet ( #PCDATA ) >

<!ELEMENT TInst ( #PCDATA ) >

<!ELEMENT DIter (Step*,Action+,Summary?,NodeArgs)>
<!ATTLIST DIter rID ID #REQUIRED iterID CDATA #REQUIRED>

<!ELEMENT DocLocation ( #PCDATA )>

<!ELEMENT Action (AName,AIter*,(Step|HtmlStep|Action)*, Summary,ActionMaintenanceSummary*, NodeArgs ) >
<!ATTLIST Action rID ID #REQUIRED>

<!ELEMENT AIter ((Step|HtmlStep|Action)*,DataMapping?, Summary?,NodeArgs) >
<!ATTLIST AIter rID ID #REQUIRED iterID CDATA #REQUIRED isCountable (False|True) "False" >

<!ELEMENT AName ( #PCDATA ) >

<!ELEMENT TestMaintenanceSummary (ActionMaintenanceSummary*) >
<!ATTLIST TestMaintenanceSummary ObjectsAdded CDATA #REQUIRED ObjectsUpdated CDATA #REQUIRED StepsUpdated CDATA #REQUIRED StepsComments CDATA #REQUIRED><!ELEMENT ActionMaintenanceSummary (ObjectChange* ) >
<!ATTLIST ActionMaintenanceSummary Action CDATA #REQUIRED Objects CDATA #REQUIRED Updated CDATA #REQUIRED LinesTotal CDATA #REQUIRED Added CDATA #REQUIRED LinesUpdated CDATA #REQUIRED>

<!ELEMENT ObjectChange  (Hierarchy, PropertyChangeList* ) >
<!ATTLIST ObjectChange Operation CDATA #IMPLIED OriginalRepository CDATA #IMPLIED>

<!ELEMENT PropertyChangeList (PropertyDef*) >

<!ELEMENT PropertyDef (OriginalValue, NewValue) >
<!ATTLIST PropertyDef PropName CDATA #REQUIRED OriginRegularExpression (True|False) "False" NewRegularExpression (True|False) "False" AddedProperty (True|False) "False" >

<!ELEMENT OriginalValue ( #PCDATA )>

<!ELEMENT NewValue ( #PCDATA )>

<!ELEMENT Hierarchy  (ObjectName, Hierarchy*) >
<!ATTLIST Hierarchy MicClass CDATA #REQUIRED>

<!ELEMENT ObjectName  ( #PCDATA ) >

<!ELEMENT Step (Obj,Details,Time,TimeTick* ,(Step|HtmlStep|Doc)*, DataMapping?, NodeArgs) >
<!ATTLIST Step rID ID #REQUIRED retval CDATA #IMPLIED>

<!ELEMENT HtmlStep (HTML,TimeTick*,(Step|HtmlStep|Doc)*,NodeArgs) >
<!ATTLIST HtmlStep rID ID #REQUIRED >

<!ELEMENT Obj ( #PCDATA ) >
<!ATTLIST Obj plainTxt (False|True) "True">

<!ELEMENT Details ( #PCDATA ) >
<!ATTLIST Details plainTxt (False|True) "True">

<!ELEMENT Time ( #PCDATA ) >

<!ELEMENT HTML ( #PCDATA ) >

<!ELEMENT Disp ( #PCDATA ) >

<!ELEMENT TimeTick ( #PCDATA ) >

<!ELEMENT DataMapping ( DataMappedItem* )>
<!ELEMENT DataMappedItem EMPTY >
<!ATTLIST DataMappedItem dsName CDATA #REQUIRED >
<!ATTLIST DataMappedItem rowId CDATA #REQUIRED >

<!ELEMENT NodeArgs (Disp,TopPane?,BtmPane?,ExtendedInfo? )>
<!ATTLIST NodeArgs eType CDATA #REQUIRED icon CDATA #REQUIRED nRep CDATA #REQUIRED UserNote CDATA #IMPLIED filter (False|True) "True">
<!ATTLIST NodeArgs status (Passed|Failed|Done|Warning|Information) "Done">
<!ATTLIST NodeArgs iconSel CDATA #IMPLIED nType CDATA #IMPLIED MovieMarker CDATA "">
<!ATTLIST NodeArgs Source CDATA #IMPLIED SourceLine CDATA #IMPLIED StepFlowItemKey CDATA #IMPLIED >

<!ELEMENT TopPane (Path)>

<!ELEMENT BtmPane ( (Path|WR)?,ASHilite?)>
<!ATTLIST BtmPane vType CDATA "HTML">

<!ELEMENT Path ( #PCDATA ) >

<!ELEMENT ASHilite ( #PCDATA ) >

<!ELEMENT WR ( #PCDATA ) >

<!ELEMENT ExtendedInfo ( StepData ) >

<!ATTLIST ExtendedInfo StepType CDATA #REQUIRED>
<!ELEMENT DT (NodeArgs) >
<!ATTLIST DT rID ID #REQUIRED>

<!ELEMENT Summary (Param*)>
<!ATTLIST Summary sTime CDATA #IMPLIED eTime CDATA #IMPLIED passed CDATA #IMPLIED failed CDATA #IMPLIED warnings CDATA #IMPLIED retval CDATA #IMPLIED stopped (False|True) "False" >

<!ELEMENT Param (ParamName,ParamVal)+ >
<!ATTLIST Param paramInOut (In|Out) "In">

<!ELEMENT ParamName ( #PCDATA ) >

<!ELEMENT ParamVal ( #PCDATA ) >

]
>
<Report ver="2.0" tmZone="India Standard Time">
<General productName="Micro Focus Unified Functional Testing" productVer="15.0" os="" host="MM09713P1"><DocLocation><![CDATA[C:\Users\mm09713\SI_Automation\SI_Driverscript]]></DocLocation></General>
<Doc rID="T1"   productName= "Micro Focus Unified Functional Testing"  >
<DName><![CDATA[SI_Driverscript]]></DName>
<Res><![CDATA[Res1]]></Res>
<DT rID="T2">
<NodeArgs eType="Table" icon="2" nRep="4" filter="False" >
<Disp><![CDATA[Run-Time Data Table]]></Disp>
<BtmPane vType="Table" >
<Path><![CDATA[Default.xlsx]]></Path>
</BtmPane>
</NodeArgs>
</DT>
<Action rID="T3">
<AName><![CDATA[Action1]]></AName>
<Step rID="T4">
<Obj plainTxt="False" ><![CDATA[SystemUtil]]></Obj>
<Details plainTxt="False" ><![CDATA[SystemUtil]]></Details>
<Time><![CDATA[3/30/2021 - 17:49:28]]></Time>
<TimeTick>1617106768</TimeTick>
<Step rID="T5">
<Obj plainTxt="False" ><![CDATA[Run "C:\Program Files (x86)\Google\Chrome\Application\chrome.exe",1]]></Obj>
<Details plainTxt="False" ><![CDATA[Run "C:\Program Files (x86)\Google\Chrome\Application\chrome.exe",1]]></Details>
<Time><![CDATA[3/30/2021 - 17:49:28]]></Time>
<TimeTick>1617106768</TimeTick>
<NodeArgs eType="Replay" icon="4" nRep="10" status="Passed" >
<Disp><![CDATA[Run "C:\Program Files (x86)\Google\Chrome\Application\chrome.exe",1]]></Disp>
</NodeArgs>
</Step>
<NodeArgs eType="Replay" icon="4" nRep="9" status="Passed" >
<Disp><![CDATA[SystemUtil]]></Disp>
</NodeArgs>
</Step>
<Step rID="T6">
<Obj plainTxt="False" ><![CDATA[[ WebElement ].Exist]]></Obj>
<Details plainTxt="False" ><![CDATA["Object does not exist"]]></Details>
<Time><![CDATA[3/30/2021 - 17:49:56]]></Time>
<TimeTick>1617106796</TimeTick>
<NodeArgs eType="Replay" icon="5" nRep="46" >
<Disp><![CDATA[[ WebElement ].Exist]]></Disp>
</NodeArgs>
</Step>
<Step rID="T7">
<Obj plainTxt="False" ><![CDATA[[ Graphic Link FieldNet ].Click]]></Obj>
<Details plainTxt="False" ><![CDATA[]]></Details>
<Time><![CDATA[3/30/2021 - 17:49:57]]></Time>
<TimeTick>1617106797</TimeTick>
<NodeArgs eType="Replay" icon="6" nRep="49" >
<Disp><![CDATA[[ Graphic Link FieldNet ].Click]]></Disp>
</NodeArgs>
</Step>
<Step rID="T8">
<Obj plainTxt="False" ><![CDATA[[ Illustrations ].Click]]></Obj>
<Details plainTxt="False" ><![CDATA[]]></Details>
<Time><![CDATA[3/30/2021 - 17:50:05]]></Time>
<TimeTick>1617106805</TimeTick>
<NodeArgs eType="Replay" icon="7" nRep="53" >
<Disp><![CDATA[[ Illustrations ].Click]]></Disp>
</NodeArgs>
</Step>
<Step rID="T9">
<Obj plainTxt="False" ><![CDATA[[ Life Illustrations (MMDesigns) ].Click]]></Obj>
<Details plainTxt="False" ><![CDATA[]]></Details>
<Time><![CDATA[3/30/2021 - 17:50:06]]></Time>
<TimeTick>1617106806</TimeTick>
<NodeArgs eType="Replay" icon="7" nRep="56" >
<Disp><![CDATA[[ Life Illustrations (MMDesigns) ].Click]]></Disp>
</NodeArgs>
</Step>
<Step rID="T10">
<Obj plainTxt="False" ><![CDATA[[ Close ].Exist]]></Obj>
<Details plainTxt="False" ><![CDATA["Object exists"]]></Details>
<Time><![CDATA[3/30/2021 - 17:50:12]]></Time>
<TimeTick>1617106812</TimeTick>
<NodeArgs eType="Replay" icon="8" nRep="58" >
<Disp><![CDATA[[ Close ].Exist]]></Disp>
</NodeArgs>
</Step>
<Step rID="T11">
<Obj plainTxt="False" ><![CDATA[[ Close ].Click]]></Obj>
<Details plainTxt="False" ><![CDATA[]]></Details>
<Time><![CDATA[3/30/2021 - 17:50:12]]></Time>
<TimeTick>1617106812</TimeTick>
<NodeArgs eType="Replay" icon="8" nRep="61" >
<Disp><![CDATA[[ Close ].Click]]></Disp>
</NodeArgs>
</Step>
<Step rID="T12">
<Obj plainTxt="False" ><![CDATA[[ MassMutual Designs - Client Editor ].Maximize]]></Obj>
<Details plainTxt="False" ><![CDATA[]]></Details>
<Time><![CDATA[3/30/2021 - 17:50:12]]></Time>
<TimeTick>1617106812</TimeTick>
<NodeArgs eType="Replay" icon="9" nRep="63" >
<Disp><![CDATA[[ MassMutual Designs - Client Editor ].Maximize]]></Disp>
</NodeArgs>
</Step>
<Step rID="T13">
<Obj plainTxt="False" ><![CDATA[[ MassMutual Designs - Client Editor ].Sync]]></Obj>
<Details plainTxt="False" ><![CDATA[]]></Details>
<Time><![CDATA[3/30/2021 - 17:50:13]]></Time>
<TimeTick>1617106813</TimeTick>
<NodeArgs eType="Replay" icon="10" nRep="66" >
<Disp><![CDATA[[ MassMutual Designs - Client Editor ].Sync]]></Disp>
</NodeArgs>
</Step>
<Step rID="T14">
<Obj plainTxt="False" ><![CDATA[[ WebElement ].Exist]]></Obj>
<Details plainTxt="False" ><![CDATA["Object does not exist"]]></Details>
<Time><![CDATA[3/30/2021 - 17:50:15]]></Time>
<TimeTick>1617106815</TimeTick>
<NodeArgs eType="Replay" icon="5" nRep="71" >
<Disp><![CDATA[[ WebElement ].Exist]]></Disp>
</NodeArgs>
</Step>
<Step rID="T15">
<Obj plainTxt="False" ><![CDATA[[ WebElement ].Exist]]></Obj>
<Details plainTxt="False" ><![CDATA["Object does not exist"]]></Details>
<Time><![CDATA[3/30/2021 - 17:50:18]]></Time>
<TimeTick>1617106818</TimeTick>
<NodeArgs eType="Replay" icon="5" nRep="77" >
<Disp><![CDATA[[ WebElement ].Exist]]></Disp>
</NodeArgs>
</Step>
<Step rID="T16">
<Obj plainTxt="False" ><![CDATA[[ Image ].Exist]]></Obj>
<Details plainTxt="False" ><![CDATA["Object does not exist"]]></Details>
<Time><![CDATA[3/30/2021 - 17:50:20]]></Time>
<TimeTick>1617106820</TimeTick>
<NodeArgs eType="Replay" icon="6" nRep="113" >
<Disp><![CDATA[[ Image ].Exist]]></Disp>
</NodeArgs>
</Step>
<Step rID="T17">
<Obj plainTxt="False" ><![CDATA[[ btnInforce ].Click]]></Obj>
<Details plainTxt="False" ><![CDATA[]]></Details>
<Time><![CDATA[3/30/2021 - 17:50:20]]></Time>
<TimeTick>1617106820</TimeTick>
<NodeArgs eType="Replay" icon="5" nRep="116" >
<Disp><![CDATA[[ btnInforce ].Click]]></Disp>
</NodeArgs>
</Step>
<Step rID="T18">
<Obj plainTxt="False" ><![CDATA[[ Continue ].Exist]]></Obj>
<Details plainTxt="False" ><![CDATA["Object exists"]]></Details>
<Time><![CDATA[3/30/2021 - 17:50:23]]></Time>
<TimeTick>1617106823</TimeTick>
<NodeArgs eType="Replay" icon="5" nRep="118" >
<Disp><![CDATA[[ Continue ].Exist]]></Disp>
</NodeArgs>
</Step>
<Step rID="T19">
<Obj plainTxt="False" ><![CDATA[[ Continue ].Click]]></Obj>
<Details plainTxt="False" ><![CDATA[]]></Details>
<Time><![CDATA[3/30/2021 - 17:50:23]]></Time>
<TimeTick>1617106823</TimeTick>
<NodeArgs eType="Replay" icon="5" nRep="121" >
<Disp><![CDATA[[ Continue ].Click]]></Disp>
</NodeArgs>
</Step>
<Step rID="T20">
<Obj plainTxt="False" ><![CDATA[[ MM Designs Inforce Entry Page ].Maximize]]></Obj>
<Details plainTxt="False" ><![CDATA[]]></Details>
<Time><![CDATA[3/30/2021 - 17:50:25]]></Time>
<TimeTick>1617106825</TimeTick>
<NodeArgs eType="Replay" icon="9" nRep="123" >
<Disp><![CDATA[[ MM Designs Inforce Entry Page ].Maximize]]></Disp>
</NodeArgs>
</Step>
<Step rID="T21">
<Obj plainTxt="False" ><![CDATA[[ policyNumber ].Set]]></Obj>
<Details plainTxt="False" ><![CDATA["8271306"]]></Details>
<Time><![CDATA[3/30/2021 - 17:50:25]]></Time>
<TimeTick>1617106825</TimeTick>
<NodeArgs eType="Replay" icon="11" nRep="126" >
<Disp><![CDATA[[ policyNumber ].Set]]></Disp>
</NodeArgs>
</Step>
<Step rID="T22">
<Obj plainTxt="False" ><![CDATA[[ search_grey ].Click]]></Obj>
<Details plainTxt="False" ><![CDATA[]]></Details>
<Time><![CDATA[3/30/2021 - 17:50:26]]></Time>
<TimeTick>1617106826</TimeTick>
<NodeArgs eType="Replay" icon="6" nRep="129" >
<Disp><![CDATA[[ search_grey ].Click]]></Disp>
</NodeArgs>
</Step>
<Step rID="T23">
<Obj plainTxt="False" ><![CDATA[[ continue_grey ].Click]]></Obj>
<Details plainTxt="False" ><![CDATA[]]></Details>
<Time><![CDATA[3/30/2021 - 17:50:29]]></Time>
<TimeTick>1617106829</TimeTick>
<NodeArgs eType="Replay" icon="6" nRep="132" >
<Disp><![CDATA[[ continue_grey ].Click]]></Disp>
</NodeArgs>
</Step>
<Step rID="T24">
<Obj plainTxt="False" ><![CDATA[[ WebElement ].Exist]]></Obj>
<Details plainTxt="False" ><![CDATA["Object does not exist"]]></Details>
<Time><![CDATA[3/30/2021 - 17:50:55]]></Time>
<TimeTick>1617106855</TimeTick>
<NodeArgs eType="Replay" icon="5" nRep="168" >
<Disp><![CDATA[[ WebElement ].Exist]]></Disp>
</NodeArgs>
</Step>
<Step rID="T25">
<Obj plainTxt="False" ><![CDATA[[ WebElement ].Exist]]></Obj>
<Details plainTxt="False" ><![CDATA["Object does not exist"]]></Details>
<Time><![CDATA[3/30/2021 - 17:51:15]]></Time>
<TimeTick>1617106875</TimeTick>
<NodeArgs eType="Replay" icon="5" nRep="222" >
<Disp><![CDATA[[ WebElement ].Exist]]></Disp>
</NodeArgs>
</Step>
<Step rID="T26">
<Obj ><![CDATA[Request for Inforce policy data is complete]]></Obj>
<Details ><![CDATA[policy is successful]]></Details>
<Time><![CDATA[3/30/2021 - 17:51:15]]></Time>
<TimeTick>1617106875</TimeTick>
<NodeArgs eType="User" icon="12" nRep="223" status="Warning" >
<Disp><![CDATA[Request for Inforce policy data is complete]]></Disp>
</NodeArgs>
</Step>
<Step rID="T27">
<Obj plainTxt="False" ><![CDATA[[ MassMutual Designs - Client Editor ].Sync]]></Obj>
<Details plainTxt="False" ><![CDATA[]]></Details>
<Time><![CDATA[3/30/2021 - 17:51:15]]></Time>
<TimeTick>1617106875</TimeTick>
<NodeArgs eType="Replay" icon="10" nRep="226" >
<Disp><![CDATA[[ MassMutual Designs - Client Editor ].Sync]]></Disp>
</NodeArgs>
</Step>
<Step rID="T28">
<Obj plainTxt="False" ><![CDATA[[ Agent Info ].Exist]]></Obj>
<Details plainTxt="False" ><![CDATA["Object exists"]]></Details>
<Time><![CDATA[3/30/2021 - 17:51:16]]></Time>
<TimeTick>1617106876</TimeTick>
<NodeArgs eType="Replay" icon="5" nRep="228" >
<Disp><![CDATA[[ Agent Info ].Exist]]></Disp>
</NodeArgs>
</Step>
<Step rID="T29">
<Obj plainTxt="False" ><![CDATA[[ Agent Info ].Click]]></Obj>
<Details plainTxt="False" ><![CDATA[]]></Details>
<Time><![CDATA[3/30/2021 - 17:51:16]]></Time>
<TimeTick>1617106876</TimeTick>
<NodeArgs eType="Replay" icon="5" nRep="231" >
<Disp><![CDATA[[ Agent Info ].Click]]></Disp>
</NodeArgs>
</Step>
<Step rID="T30">
<Obj plainTxt="False" ><![CDATA[[ Agent468473 ].Exist]]></Obj>
<Details plainTxt="False" ><![CDATA["Object exists"]]></Details>
<Time><![CDATA[3/30/2021 - 17:51:16]]></Time>
<TimeTick>1617106876</TimeTick>
<NodeArgs eType="Replay" icon="5" nRep="233" >
<Disp><![CDATA[[ Agent468473 ].Exist]]></Disp>
</NodeArgs>
</Step>
<Step rID="T31">
<Obj plainTxt="False" ><![CDATA[[ Agent468473 ].Click]]></Obj>
<Details plainTxt="False" ><![CDATA[]]></Details>
<Time><![CDATA[3/30/2021 - 17:51:16]]></Time>
<TimeTick>1617106876</TimeTick>
<NodeArgs eType="Replay" icon="5" nRep="236" >
<Disp><![CDATA[[ Agent468473 ].Click]]></Disp>
</NodeArgs>
</Step>
<Step rID="T32">
<Obj plainTxt="False" ><![CDATA[[ Default Agent ].Exist]]></Obj>
<Details plainTxt="False" ><![CDATA["Object exists"]]></Details>
<Time><![CDATA[3/30/2021 - 17:51:17]]></Time>
<TimeTick>1617106877</TimeTick>
<NodeArgs eType="Replay" icon="5" nRep="238" >
<Disp><![CDATA[[ Default Agent ].Exist]]></Disp>
</NodeArgs>
</Step>
<Step rID="T33">
<Obj plainTxt="False" ><![CDATA[[ WebCheckBox ].Set]]></Obj>
<Details plainTxt="False" ><![CDATA["ON"]]></Details>
<Time><![CDATA[3/30/2021 - 17:51:17]]></Time>
<TimeTick>1617106877</TimeTick>
<NodeArgs eType="Replay" icon="13" nRep="241" >
<Disp><![CDATA[[ WebCheckBox ].Set]]></Disp>
</NodeArgs>
</Step>
<Step rID="T34">
<Obj plainTxt="False" ><![CDATA[[ Calc ].Click]]></Obj>
<Details plainTxt="False" ><![CDATA[]]></Details>
<Time><![CDATA[3/30/2021 - 17:51:19]]></Time>
<TimeTick>1617106879</TimeTick>
<NodeArgs eType="Replay" icon="5" nRep="245" >
<Disp><![CDATA[[ Calc ].Click]]></Disp>
</NodeArgs>
</Step>
<Step rID="T35">
<Obj plainTxt="False" ><![CDATA[[ wfw_imagefetch.aspx ].Exist]]></Obj>
<Details plainTxt="False" ><![CDATA["Object exists"]]></Details>
<Time><![CDATA[3/30/2021 - 17:51:32]]></Time>
<TimeTick>1617106892</TimeTick>
<NodeArgs eType="Replay" icon="9" nRep="246" >
<Disp><![CDATA[[ wfw_imagefetch.aspx ].Exist]]></Disp>
</NodeArgs>
</Step>
<Step rID="T36">
<Obj plainTxt="False" ><![CDATA[[ wfw_imagefetch.aspx ].Close]]></Obj>
<Details plainTxt="False" ><![CDATA[]]></Details>
<Time><![CDATA[3/30/2021 - 17:51:32]]></Time>
<TimeTick>1617106892</TimeTick>
<NodeArgs eType="Replay" icon="9" nRep="248" >
<Disp><![CDATA[[ wfw_imagefetch.aspx ].Close]]></Disp>
</NodeArgs>
</Step>
<Step rID="T37">
<Obj plainTxt="False" ><![CDATA[[ Image ].Exist]]></Obj>
<Details plainTxt="False" ><![CDATA["Object does not exist"]]></Details>
<Time><![CDATA[3/30/2021 - 17:51:35]]></Time>
<TimeTick>1617106895</TimeTick>
<NodeArgs eType="Replay" icon="6" nRep="254" >
<Disp><![CDATA[[ Image ].Exist]]></Disp>
</NodeArgs>
</Step>
<Step rID="T38">
<Obj plainTxt="False" ><![CDATA[[ pdf ].Exist]]></Obj>
<Details plainTxt="False" ><![CDATA["Object exists"]]></Details>
<Time><![CDATA[3/30/2021 - 17:51:36]]></Time>
<TimeTick>1617106896</TimeTick>
<NodeArgs eType="Replay" icon="6" nRep="256" >
<Disp><![CDATA[[ pdf ].Exist]]></Disp>
</NodeArgs>
</Step>
<Step rID="T39">
<Obj ><![CDATA[Policy number calculation is completed]]></Obj>
<Details ><![CDATA[Policy number calculated]]></Details>
<Time><![CDATA[3/30/2021 - 17:51:36]]></Time>
<TimeTick>1617106896</TimeTick>
<NodeArgs eType="User" icon="12" nRep="258" status="Passed" >
<Disp><![CDATA[Policy number calculation is completed]]></Disp>
</NodeArgs>
</Step>
<Step rID="T40">
<Obj plainTxt="False" ><![CDATA[[ pdf ].Click]]></Obj>
<Details plainTxt="False" ><![CDATA[]]></Details>
<Time><![CDATA[3/30/2021 - 17:51:40]]></Time>
<TimeTick>1617106900</TimeTick>
<NodeArgs eType="Replay" icon="6" nRep="261" >
<Disp><![CDATA[[ pdf ].Click]]></Disp>
</NodeArgs>
</Step>
<Step rID="T41">
<Obj plainTxt="False" ><![CDATA[Google Chrome]]></Obj>
<Details plainTxt="False" ><![CDATA[Window]]></Details>
<Time><![CDATA[3/30/2021 - 17:51:59]]></Time>
<TimeTick>1617106919</TimeTick>
<Step rID="T42">
<Obj plainTxt="False" ><![CDATA[Save As]]></Obj>
<Details plainTxt="False" ><![CDATA[Dialog]]></Details>
<Time><![CDATA[3/30/2021 - 17:51:59]]></Time>
<TimeTick>1617106919</TimeTick>
<Step rID="T43">
<Obj plainTxt="False" ><![CDATA[File name:.Type]]></Obj>
<Details plainTxt="False" ><![CDATA[""]]></Details>
<Time><![CDATA[3/30/2021 - 17:51:59]]></Time>
<TimeTick>1617106919</TimeTick>
<NodeArgs eType="Replay" icon="16" nRep="265" >
<Disp><![CDATA[File name:.Type]]></Disp>
</NodeArgs>
</Step>
<Step rID="T44">
<Obj plainTxt="False" ><![CDATA[File name:.Type]]></Obj>
<Details plainTxt="False" ><![CDATA["C:\Users\mm09713\SI_Results\8271306"]]></Details>
<Time><![CDATA[3/30/2021 - 17:52:03]]></Time>
<TimeTick>1617106923</TimeTick>
<NodeArgs eType="Replay" icon="16" nRep="267" >
<Disp><![CDATA[File name:.Type]]></Disp>
</NodeArgs>
</Step>
<Step rID="T45">
<Obj plainTxt="False" ><![CDATA[Save.Click]]></Obj>
<Details plainTxt="False" ><![CDATA[]]></Details>
<Time><![CDATA[3/30/2021 - 17:52:07]]></Time>
<TimeTick>1617106927</TimeTick>
<NodeArgs eType="Replay" icon="17" nRep="269" >
<Disp><![CDATA[Save.Click]]></Disp>
</NodeArgs>
</Step>
<Step rID="T46">
<Obj plainTxt="False" ><![CDATA[[ wfw_imagefetch.aspx ].Close]]></Obj>
<Details plainTxt="False" ><![CDATA[]]></Details>
<Time><![CDATA[3/30/2021 - 17:52:12]]></Time>
<TimeTick>1617106932</TimeTick>
<NodeArgs eType="Replay" icon="9" nRep="271" >
<Disp><![CDATA[[ wfw_imagefetch.aspx ].Close]]></Disp>
</NodeArgs>
</Step>
<NodeArgs eType="Context" icon="15" nRep="264" >
<Disp><![CDATA[Save As]]></Disp>
</NodeArgs>
</Step>
<NodeArgs eType="Context" icon="14" nRep="263" >
<Disp><![CDATA[Google Chrome]]></Disp>
</NodeArgs>
</Step>
<Summary sTime="3/30/2021 - 17:49:15" eTime="3/30/2021 - 17:52:38" passed="2" failed="0" warnings="1" ></Summary>
<NodeArgs eType="StartAction" icon="3" nRep="6" status="Warning" >
<Disp><![CDATA[Action1 Summary]]></Disp>
</NodeArgs>
</Action>
<Summary sTime="3/30/2021 - 17:49:14" eTime="3/30/2021 - 17:52:38" passed="2" failed="0" warnings="1" ></Summary>
<NodeArgs eType="StartTest" icon="1" nRep="3" status="Warning" >
<Disp><![CDATA[Test SI_Driverscript Summary]]></Disp>
</NodeArgs>
</Doc>
</Report>